L1,L2,L3,Description
Automobile Accessories,Exterior Accessories,Spoilers & Body Kits,"
Sure! Here is a professional and concise description for the subcategory ""Spoilers & Body Kits"" within the main category ""Exterior Accessories"":

""Elevate your vehicle's performance and style with our spoilers and body kits. From sleek aerodynamic designs to aggressive racing-inspired styles, we have the perfect upgrade for your car or truck."""
Automobile Accessories,Lighting & Electricals,LED Headlights,"
LED Headlights are a crucial component in modern vehicles, providing enhanced visibility and safety on the road. These high-performance headlights use light-emitting diode (LED) technology to produce a brighter, more focused beam, improving nighttime driving and reducing eye strain for both drivers and passengers."
Automobile Accessories,Lighting & Electricals,Fog Lights,"
Fog Lights: High-performance lighting solutions for improved visibility in low-light conditions. Enhance driving safety with our advanced LED technology."
Automobile Accessories,Lighting & Electricals,Interior LED Strips,"
Sure! Here's a professional and industry-specific description for Interior LED Strips within the main category of Lighting & Electricals:

Interior LED Strips are versatile, energy-efficient lighting solutions for home or office decor. Adjustable brightness and color options create customizable ambiance for any space."
Automobile Accessories,Lighting & Electricals,DRLs (Daytime Running Lights),"
Sure! Here is a professional, industry-specific description for the subcategory ""DRLs (Daytime Running Lights)"" within the main category ""Lighting & Electricals"":

""Daytime Running Lights (DRLs) are automatic lights that illuminate the front of your vehicle during daylight hours, enhancing visibility and safety on the road. Our DRLs are designed to provide a clear view of the road ahead without obstructing your vision."""
Automobile Accessories,Lighting & Electricals,Horns & Buzzers,"
Sure! Here is a professional, industry-specific description for the subcategory ""Horns & Buzzers"" within the main category ""Lighting & Electricals"":

""Electronic horns and buzzers for various applications, including home automation, alarm systems, and industrial settings. Products include sirens, strobe lights, and other warning devices."""
Automobile Accessories,Car Care & Maintenance,Car Shampoos & Waxes,"
Sure! Here is a professional, industry-specific description for the subcategory ""Car Shampoos & Waxes"" within the main category ""Car Care & Maintenance"":

""Keep your car looking and feeling its best with our selection of high-quality car shampoos and waxes. From gentle cleaning formulas to durable protective coatings, we've got you covered."""
Automobile Accessories,Car Care & Maintenance,Microfiber Cloths,"
Sure! Here's a concise and industry-specific description for Microfiber Cloths within the Car Care & Maintenance main category:

Microfiber cloths are gentle yet effective cleaning tools for car care. Use them to wipe down surfaces, remove dirt and grime without scratching or damaging your vehicle's paint."
Automobile Accessories,Car Care & Maintenance,Tire Cleaners & Polishes,"
Tire Cleaners & Polishes: Keep your tires looking and performing their best with our selection of high-quality cleaners and polishes. From everyday dirt and grime to minor scuffs and scratches, we've got the right products for the job."
Automobile Accessories,Car Care & Maintenance,Dashboard Cleaners,"
Here is a professional, industry-specific description for the subcategory ""Dashboard Cleaners"" within the main category ""Car Care & Maintenance"":

""Keep your dashboard looking new with our expert cleaning services. From crumbs to dirt, we'll leave your dashboard spotless and fresh."""
Automobile Accessories,Car Care & Maintenance,Car Vacuum Cleaners,"
Car vacuum cleaners are essential tools for car owners who want to keep their vehicles clean and well-maintained. These devices are specifically designed to remove dirt, dust, and debris from various surfaces within a car, including the interior and exterior. With a car vacuum cleaner, you can easily and effectively clean your car without having to rely on expensive car wash services."
Automobile Accessories,Performance Accessories,Engine Oil Additives,"
Sure! Here's a professional and industry-specific description for Engine Oil Additives in the subcategory of Performance Accessories:

Engine Oil Additives enhance the performance of your engine by improving oil circulation, reducing wear and tear, and protecting against corrosion. Boost your car's power and longevity with our high-quality additives designed to optimize engine performance."
Automobile Accessories,Performance Accessories,Performance Air Filters,"
Sure! Here is a professional, industry-specific description for the subcategory ""Performance Air Filters"" within the main category ""Performance Accessories"":

""Upgrade your vehicle's air intake with our high-performance air filters. Designed to improve engine performance and increase fuel efficiency, these filters provide cleaner air intake for optimal engine function."""
Automobile Accessories,Performance Accessories,Exhaust System Enhancements,"
Sure! Here's a professional, industry-specific description for the subcategory ""Exhaust System Enhancements"" within the main category ""Performance Accessories"":

""Maximize your vehicle's performance with our exhaust system enhancements, designed to increase power and torque while reducing noise. From high-flow mufflers to free-flowing exhaust pipes, our products are engineered to deliver optimal results."""
Automobile Accessories,Performance Accessories,Suspension Kits,"
Sure! Here's a professional and concise description for the subcategory ""Suspension Kits"" within the main category ""Performance Accessories"":

""Upgrade your vehicle's suspension with our performance kits, designed to improve handling and stability on the road. Whether you're a daily driver or a track enthusiast, our kits offer a customizable solution for enhanced driving experience."""
Travel Bags & Essentials,Luggage,Hard-Shell Suitcases,"
Hard-Shell Suitcases - Tough and durable luggage for long-lasting protection of your belongings during travel. Built to withstand rough handling and extreme conditions."
Travel Bags & Essentials,Luggage,Soft-Shell Suitcases,"
Soft-Shell Suitcases are lightweight and flexible luggage options designed for maximum convenience and comfort. These suitcases feature a soft, pliable outer shell that provides added protection against scratches and bumps, while still maintaining the durability and security of traditional hard-shell luggage."
Travel Bags & Essentials,Luggage,Cabin Luggage,"
Certainly! Here is a professional and concise description for the subcategory ""Cabin Luggage"" within the main category ""Luggage"":

Cabin Luggage: Designed for easy transportation in aircraft cabins, these lightweight and compact bags provide organized storage for essentials during short trips."
Travel Bags & Essentials,Luggage,Check-in Luggage,"
Check-in Luggage refers to luggage designed for travelers who want to check their bags during flights. These bags are typically made of durable materials, have spacious interiors, and may include features like wheels and handles for ease of transport."
Travel Bags & Essentials,Luggage,Duffel Bags,"
Sure! Here is a professional, industry-specific description for the subcategory ""Duffel Bags"" within the main category ""Luggage"":

Duffel bags are sturdy, spacious luggage bags designed for long trips and adventures. Perfect for travelers who want a durable and comfortable carry-on option."
Travel Bags & Essentials,Luggage,Trolley Bags,"
Sure! Here's a professional and concise subcategory description for Trolley Bags within the Luggage category:

Trolley Bags: Durable and lightweight bags designed for easy transportation, featuring spacious interiors and comfortable handles for hands-free mobility. Perfect for long trips or daily commutes."
Travel Bags & Essentials,Luggage,Rolling Suitcases,"
Rolling Suitcases: High-quality, durable luggage designed for ease of transport with built-in wheels, providing a convenient and comfortable travel experience."
Travel Bags & Essentials,Backpacks,Hiking Backpacks,"
Hiking Backpacks: Designed for adventure seekers, these backpacks are built to last with durable materials and thoughtful features like multiple compartments and hydration pockets. Perfect for long treks through the wilderness."
Travel Bags & Essentials,Backpacks,Laptop Backpacks,"
Sure! Here's a concise and industry-specific description for the subcategory ""Laptop Backpacks"" within the main category ""Backpacks"":

Laptop Backpacks: Stylish and functional backpacks designed specifically for carrying laptops, tablets, and other tech essentials. Perfect for students, professionals, and travelers who need a secure and comfortable way to transport their devices on the go."
Travel Bags & Essentials,Backpacks,Travel Backpacks,"
Backpacks > Travel Backpacks: Designed for long trips and adventures, these lightweight backpacks offer spacious interiors, comfortable shoulder straps, and durable construction for a hassle-free travel experience."
Travel Bags & Essentials,Backpacks,Anti-Theft Backpacks,"
Sure! Here is a professional, industry-specific description for the subcategory ""Anti-Theft Backpacks"" within the main category ""Backpacks"":

""Protect your valuables with our anti-theft backpacks, designed with advanced security features to deter theft and keep your belongings safe. From laptops to cash, these backpacks offer maximum protection on-the-go."""
Travel Bags & Essentials,Backpacks,Rucksack Bags,"
""Rucksack bags are designed for comfort and durability, providing a stable and secure carrying solution for daily essentials or outdoor adventures. With spacious interiors and comfortable shoulder straps, these backpacks offer the perfect balance of functionality and style."""
Travel Bags & Essentials,Handbags & Tote Bags,Travel Tote Bags,"
Sure, here's a professional and industry-specific description for the subcategory ""Travel Tote Bags"" within the main category ""Handbags & Tote Bags"":

""Stylish and functional travel totes designed to keep your essentials organized and easily accessible during your next adventure. Perfect for weekend getaways, business trips, or international travel."""
Travel Bags & Essentials,Handbags & Tote Bags,Shoulder Bags,"
Sure! Here is a professional and concise subcategory description for Shoulder Bags within the main category of Handbags & Tote Bags:

Shoulder Bags - Stylish and practical, these bags are designed to be worn over the shoulder, offering easy access to your essentials on-the-go. Perfect for busy professionals or students, our selection includes a range of styles and sizes to suit any need."
Travel Bags & Essentials,Handbags & Tote Bags,Crossbody Travel Bags,"
Here's a professional and concise description for the subcategory ""Crossbody Travel Bags"" within the main category ""Handbags & Tote Bags"":

Crossbody Travel Bags: Stylish, compact, and easy to carry, these bags are perfect for quick trips or daily adventures. Perfect for travelers who want to keep their essentials close at hand while exploring new destinations."
Travel Bags & Essentials,Handbags & Tote Bags,Messenger Bags,"
Sure! Here's a professional, industry-specific description for the subcategory ""Messenger Bags"" within the main category ""Handbags & Tote Bags"":

Messenger bags are functional and versatile handbags designed for everyday use. With multiple compartments and pockets, these bags provide ample storage space for essentials like laptops, tablets, and books, while also offering comfortable shoulder straps for easy carrying."
Travel Bags & Essentials,Pouches & Organizers,Packing Cubes,"
Sure! Here's a professional, industry-specific description for the subcategory ""Packing Cubes"" within the main category ""Pouches & Organizers"":

""Efficiently organize your luggage with our packing cubes, designed to keep clothing and essentials separated and easy to find. Save time and reduce stress during travel with these space-saving solutions."""
Travel Bags & Essentials,Pouches & Organizers,Shoe Bags,"
Sure! Here is a professional, industry-specific description for the subcategory ""Shoe Bags"" within the main category ""Pouches & Organizers"":

""Protect your shoes and keep them organized with our selection of durable shoe bags. Perfect for travel or everyday use, these bags provide easy access and keep your feet dry and comfortable."" (Under 200 characters)"
Travel Bags & Essentials,Pouches & Organizers,Toiletry Kits,"
Toiletry Kits are practical and organized solutions for carrying essentials while on-the-go. Containing a variety of compartments and pockets, these kits help keep toiletries neatly arranged and easily accessible during travel or daily use."
Travel Bags & Essentials,Pouches & Organizers,Travel Jewelry Cases,"
Sure! Here's a professional, industry-specific description for the subcategory ""Travel Jewelry Cases"" within the main category ""Pouches & Organizers"":

Travel Jewelry Cases: Keep your valuable jewels organized and protected during your next adventure with our durable, stylish cases. Perfect for storing and transporting delicate pieces while on the go."
Travel Bags & Essentials,Pouches & Organizers,Electronic Cable Organizers,"
Sure! Here is a professional, industry-specific description for the subcategory Electronic Cable Organizers within the main category Pouches & Organizers:

Electronic Cable Organizers - Keep your cables and wires organized and easy to find with our range of durable, customizable pouches and organizers. Perfect for electronics, computer, and IT professionals."
Travel Bags & Essentials,Travel Accessories,Travel Pillows,"
Sure! Here's a concise and industry-specific description for the subcategory ""Travel Pillows"" within the main category ""Travel Accessories"":

""Comfortable travel pillows provide support and comfort during long flights, trains, or road trips. Designed to cradle your head and neck, they help reduce fatigue and promote relaxation."""
Travel Bags & Essentials,Travel Accessories,Eye Masks,"
Sure! Here's a professional, industry-specific description for the subcategory ""Eye Masks"" within the main category ""Travel Accessories"":

""Comfortably shield your eyes from harsh lights and unwanted distractions during travel with our eye masks. Designed to provide complete darkness and relaxation, these masks are perfect for nighttime flights, hotel stays, or any other time you need a peaceful sleep."""
Travel Bags & Essentials,Travel Accessories,Passport Holders,"
Passport Holders - Keep Your Travel Documents Secure: Our passport holders are designed to keep your travel documents safe and secure during your adventures. With multiple sizes and styles to choose from, find the perfect fit for your needs."
Travel Bags & Essentials,Travel Accessories,Luggage Tags,"
Sure! Here's a concise and industry-specific description for the subcategory ""Luggage Tags"" within the main category ""Travel Accessories"":

Luggage Tags: Keep your luggage safe and identifiable with durable, name-branded tags. Easily locate your bags on the go with bright colors and secure attachments."
Travel Bags & Essentials,Travel Accessories,Travel Wallets,"
Sure! Here is a professional, industry-specific description for the subcategory ""Travel Wallets"" within the main category ""Travel Accessories"":

Travel Wallets: Stay organized and hands-free on the go with our durable and spacious travel wallets. Perfect for storing important documents, cash, and credit cards while exploring new destinations."
Travel Bags & Essentials,Travel Accessories,TSA Locks & Security Locks,"
TSA Locks & Security Locks for Travel Accessories: Keep Your Luggage Safe & Secure During Transit with TSA-Approved Locks. Compatible with Airline Checked Bags & Carry-On Luggage, These Locks Ensure Your Belongings Stay Protected from Theft or Damage."
Travel Bags & Essentials,Travel Essentials,Portable Luggage Scales,"
Portable luggage scales for travelers on-the-go! Accurately measure your luggage weight without the hassle of finding a scale at your destination. Save time and avoid overweight fees with these lightweight, compact scales. Perfect for frequent flyers and travel enthusiasts."
Travel Bags & Essentials,Travel Essentials,Compression Bags,"
Sure! Here is a professional, industry-specific description for the subcategory ""Compression Bags"" within the main category ""Travel Essentials"":

Compression bags are lightweight and compact luggage solutions that help you pack more in less space. Perfect for travelers who want to minimize their carry-on and save space in their suitcase."
Travel Bags & Essentials,Travel Essentials,Reusable Travel Bottles,"
Reusable travel bottles are a must-have for any frequent flyer. Made from durable materials, these containers are designed to withstand the rigors of transportation while keeping your drinks at the perfect temperature. Say goodbye to single-use plastic bottles and hello to a more sustainable travel experience."
Furniture,Living Room Furniture,Sofas & Couches,"
Sure! Here is a professional and industry-specific description for the subcategory ""Sofas & Couches"" within the main category ""Living Room Furniture"":

""Comfortable seating solutions for your living space. Browse our selection of stylish sofas and couches in various styles, sizes, and materials to find the perfect fit for your home."""
Furniture,Living Room Furniture,Recliners,"
Recliners - Relaxation at its Finest
Comfortable recliners for a cozy living room experience, perfect for unwinding after a long day. Adjust to your desired position for ultimate relaxation."
Furniture,Living Room Furniture,Coffee Tables,"
Certainly! Here is a professional, industry-specific description for the subcategory ""Coffee Tables"" within the main category ""Living Room Furniture"":

""Coffee tables are essential living room furniture pieces that provide a functional and stylish surface for displaying decorative items, books, and drinks. Choose from a range of styles, materials, and sizes to complement your home's aesthetic."""
Furniture,Living Room Furniture,TV Units & Stands,"
Sure! Here is a professional, industry-specific description for the subcategory ""TV Units & Stands"" within the main category ""Living Room Furniture"":

""Elevate your viewing experience with our stylish and functional TV units and stands. From sleek and modern designs to cozy and traditional styles, find the perfect fit for your living room."""
Furniture,Living Room Furniture,Side Tables,"
Sure! Here's a professional, industry-specific description for the subcategory ""Side Tables"" within the main category ""Living Room Furniture"":

""Elegant and functional side tables perfect for living rooms, offering storage and surface space for books, decorations, and more. Choose from various styles and materials to complement your home's aesthetic."" (Under 200 characters)"
Furniture,Living Room Furniture,Bookshelves & Display Units,"
Sure! Here's a professional and concise description for the subcategory ""Bookshelves & Display Units"" within the main category ""Living Room Furniture"":

Bookshelves & Display Units: Elegantly display your book collection or showcase your favorite items with stylish and functional bookshelves and display units. Create a cozy reading nook or add a touch of sophistication to your living room with our selection of high-quality, design-focused pieces."
Furniture,Living Room Furniture,Ottomans & Poufs,"
Ottomans & Poufs - Add Comfort and Style to Your Living Room
Transform your living room with stylish and functional ottomans and poufs. Use them as extra seating, a footrest, or as a unique piece of home decor. Find the perfect one for your space today!"
Furniture,Living Room Furniture,Wooden Benches,"
Sure! Here's a professional, industry-specific description for the subcategory ""Wooden Benches"" within the main category ""Living Room Furniture"":

Wooden benches add warmth and coziness to any living room, providing a comfortable place to sit and relax. Crafted from high-quality wood, these benches offer stylish seating options for any decor."
Furniture,Bedroom Furniture,Beds,"
Beds | Bedroom Furniture
A vital component of any bedroom, beds provide a comfortable sleeping surface for a restful night's sleep. Choose from a range of styles and materials to suit your personal preferences and create a tranquil oasis in your home."
Furniture,Bedroom Furniture,Wardrobes & Closets,"
Sure! Here is a professional and concise description for the subcategory ""Wardrobes & Closets"" within the main category of Bedroom Furniture:

""Elevate your bedroom with stylish wardrobes and closets that provide ample storage and organization solutions. From sleek and modern to classic and traditional, our range of wardrobe and closet designs cater to your personal style and space requirements."""
Furniture,Bedroom Furniture,Dressing Tables,"
Here is a professional, industry-specific description for the subcategory ""Dressing Tables"" within the main category ""Bedroom Furniture"":

""Elegant dressing tables crafted from high-quality materials, designed to enhance your morning routine with ample storage and mirror reflection. Perfect for styling hair and makeup in a comfortable and organized bedroom setting."""
Furniture,Bedroom Furniture,Nightstands & Bedside Tables,"
Sure! Here is a professional, industry-specific description for the subcategory ""Nightstands & Bedside Tables"" within the main category ""Bedroom Furniture"":

""Stylish and functional nightstands and bedside tables for convenient storage and lighting in your bedroom. Choose from various styles and materials to match your decor."""
Furniture,Bedroom Furniture,Mattresses,"
Sure! Here's a professional and concise description for the subcategory ""Mattresses"" within the main category ""Bedroom Furniture"":

""Luxurious mattresses designed to provide optimal comfort and support for a restful night's sleep. Choose from a range of materials, firmness levels, and styles to find your perfect match."""
Furniture,Bedroom Furniture,Headboards,"
Headboards: Elevate Your Sleep Experience with Stylish and Functional Designs

Our headboards offer a range of styles and materials to complement your bedroom furniture. From sleek metal designs to plush upholstered options, our headboards provide the perfect blend of form and function for a restful night's sleep."
Furniture,Dining Room Furniture,Dining Tables,"
Sure! Here's a concise and industry-specific description for the subcategory ""Dining Tables"" within the main category ""Dining Room Furniture"":

""Dining tables are sturdy, stylish pieces designed for communal meals and gatherings. Choose from a range of sizes, shapes, and materials to suit your dining room's style and layout."""
Furniture,Dining Room Furniture,Dining Chairs,"
Dining Chairs: Comfortable seating for formal or casual dining experiences. Stylish designs to match any decor."
Furniture,Dining Room Furniture,Bar Stools,"
Bar Stools - Dining Room Furniture: Comfortable seating for your home bar or kitchen island. Ergonomic design and sturdy construction for durability."
Furniture,Dining Room Furniture,Sideboards & Buffets,"
Sure! Here is a professional, industry-specific description for the subcategory ""Sideboards & Buffets"" within the main category ""Dining Room Furniture"":

""Elevate your dining experience with stylish sideboards & buffets. These versatile pieces provide ample storage and display space for dining essentials, while adding a touch of sophistication to any room."""
Furniture,Dining Room Furniture,Kitchen Cabinets,"
Sure! Here is a professional and industry-specific description for the subcategory ""Kitchen Cabinets"" within the main category ""Dining Room Furniture"":

""Kitchen Cabinets: Customizable storage solutions for your kitchen essentials, including drawers, shelves, and doors. Choose from various materials and finishes to match your kitchen's style."""
Furniture,Office Furniture,Office Chairs,"
Sure! Here's a professional, industry-specific description for the subcategory ""Office Chairs"" within the main category ""Office Furniture"":

Comfortable and supportive office chairs designed to promote productivity and well-being in the workplace. Choose from a range of styles and materials to suit your work environment and budget."
Furniture,Office Furniture,Office Desks,"
Sure! Here is a professional, industry-specific description for the subcategory ""Office Desks"" within the main category ""Office Furniture"":

""Find the perfect desk for your workspace with our wide selection of stylish and functional designs. From standing desks to ergonomic options, we have the right fit for your needs."""
Furniture,Office Furniture,Conference Tables,"
Conference Tables - Elegant spaces for collaboration. Durable, versatile designs for productive meetings."
Furniture,Office Furniture,Filing Cabinets,"
Filing Cabinets - Organize Your Office with Style & Efficiency: Our filing cabinets offer a stylish and practical solution for storing important documents and office supplies. With various sizes and styles to choose from, you can find the perfect fit for your workspace."
Furniture,Office Furniture,Bookshelves,"
Sure! Here is a professional, industry-specific description for the subcategory ""Bookshelves"" within the main category ""Office Furniture"":

""Organize your office library with sturdy bookshelves that provide ample storage space for books, files, and other office supplies. Choose from a variety of styles and sizes to fit your workspace needs."""
