L1,L2,L3,Description
Footwear and Accessories,Men's Footwear,Sandals & Floaters,"
Sure! Here is a concise and industry-specific description for the subcategory ""Sandals & Floaters"" within the main category of Men's Footwear:

""Comfortable and stylish sandals and floaters for men, designed for warm weather activities and relaxation. Featuring breathable materials, cushioned soles, and adjustable straps for a customized fit."""
Footwear and Accessories,Men's Footwear,Loafers,"
Here is a professional, industry-specific description for the subcategory ""Loafers"" within the main category ""Men's Footwear"":

Loafers are a classic style of men's footwear characterized by their slip-on design and lack of laces. These comfortable shoes are perfect for everyday wear, both on and off the job."
Footwear and Accessories,Men's Footwear,Slippers & Flip-Flops,"
Sure! Here is a professional, industry-specific description for the subcategory ""Slippers & Flip-Flops"" within the main category of Men's Footwear:

Slippers & Flip-Flops: Comfortable and practical footwear options for men, perfect for lounging around the house or poolside. Soft materials and cushioned soles provide maximum comfort and relaxation."
Footwear and Accessories,Women's Footwear,Heels,"
Sure! Here is a professional, industry-specific description for the subcategory ""Heels"" within the main category ""Women's Footwear"":

""Elevate your style with our collection of high heels, designed for confident and fashionable women who want to make a statement. From sleek and elegant pumps to bold and daring stilettos, our heels offer comfort and sophistication for any occasion."" (Under 200 characters)"
Footwear and Accessories,Women's Footwear,Flats,"
Sure! Here is a professional, industry-specific description for the subcategory ""Flats"" within the main category ""Women's Footwear"":

""Elevate your style with our collection of comfortable and fashionable flats. From slip-ons to sandals, our designs offer versatility and quality for every occasion."""
Footwear and Accessories,Women's Footwear,Sneakers,"
Sure! Here is a professional and concise description for the subcategory of Sneakers within the main category of Women's Footwear:

Sneakers: Stylish and comfortable footwear designed for active women, featuring sleek designs, cushioned soles, and breathable materials. Perfect for daily wear or athletic activities."
Footwear and Accessories,Women's Footwear,Sandals,"
Sandals - Women's Footwear: Stylish and comfortable footwear for warm weather adventures. From casual to dressy, our sandals offer supportive cushioning and breathable materials for all-day wear."
Footwear and Accessories,Women's Footwear,Ballerinas,"
Here is a professional, industry-specific description for the subcategory ""Ballerinas"" within the main category ""Women's Footwear"":

""Delicate and elegant, our ballerina shoes are designed for graceful movement and comfort. With soft, supple leather and a flexible sole, these shoes will help you take your dance technique to new heights."""
Footwear and Accessories,Women's Footwear,Wedges,"
Sure! Here is a professional, industry-specific description for the subcategory ""Wedges"" within the main category ""Women's Footwear"":

Wedges are a popular choice in women's footwear, offering comfort and style without sacrificing height. With a wide range of materials, colors, and designs available, wedges can be dressed up or down to suit any occasion."
Footwear and Accessories,Kids' Footwear,School Shoes,"
Here is a professional, industry-specific description for the subcategory ""School Shoes"" within the main category of ""Kids' Footwear"":

""School Shoes: Durable, comfortable shoes designed for kids' daily school wear. Styles range from classic lace-ups to modern slip-ons, with features like breathable mesh panels and durable outsoles for long-lasting wear."""
Footwear and Accessories,Kids' Footwear,Sports Shoes,"
Sports Shoes - Kids' Footwear: Providing comfort and support for little athletes on the move! Engineered with cushioning and traction, our sports shoes are designed to help kids stay active and play hard, whether it's soccer, basketball or running around the playground."
Footwear and Accessories,Kids' Footwear,Sandals & Floaters,"
Sure! Here is a professional, industry-specific description for the subcategory ""Sandals & Floaters"" within the main category of ""Kids' Footwear"":

""Adorable sandals and floaters for little ones, designed for comfort and fun. Perfect for beach days, pool time, or everyday wear."" (197 characters)"
Footwear and Accessories,Kids' Footwear,Flip-Flops,"
Sure! Here is a professional and industry-specific description for the subcategory ""Flip-Flops"" within the main category of Kids' Footwear:

Flip-Flops: Fun and functional footwear for kids, perfect for beach days, pool time, or everyday wear. Soft, flexible soles provide comfort and support, while vibrant colors and fun designs make them a stylish choice for little ones."
Footwear and Accessories,Footwear Accessories,Shoe Polish,"
Sure! Here is a professional, industry-specific description for the subcategory ""Shoe Polish"" within the main category ""Footwear Accessories"":

""Shoe polish is a essential accessory for maintaining the appearance and longevity of your shoes. Our high-quality polishes are designed to protect and enhance the finish of your footwear, leaving them looking like new."""
Footwear and Accessories,Footwear Accessories,Insoles & Inserts,"
Sure! Here is a professional, industry-specific description for the subcategory ""Insoles & Inserts"" within the main category ""Footwear Accessories"":

Insoles & Inserts: Customizable solutions for foot comfort and support. From arch supports to orthotics, our range of inserts and insoles provide tailored cushioning and stability for optimal foot health."
Footwear and Accessories,Footwear Accessories,Shoe Laces,"
Sure! Here is a professional, industry-specific description for the subcategory ""Shoe Laces"" within the main category ""Footwear Accessories"":

""Shoe laces are essential components of footwear, providing secure fit and comfort. Choose from a range of materials and styles to match your footwear needs."""
Footwear and Accessories,Footwear Accessories,Shoe Bags,"
Sure! Here is a professional, industry-specific description for the subcategory ""Shoe Bags"" within the main category ""Footwear Accessories"":

""Shoe bags are lightweight, versatile storage solutions for shoes. They protect footwear from dust, dirt, and damage while keeping them organized and easy to find."""
Footwear and Accessories,Footwear Accessories,Shoe Deodorizers,"
Sure! Here is a professional, industry-specific description for the subcategory ""Shoe Deodorizers"" within the main category ""Footwear Accessories"":

""Shoe deodorizers are essential for keeping your footwear fresh and odor-free. From sweat-absorbing insoles to sprays and powders, these accessories eliminate shoe stink and keep your feet feeling comfortable."""
Footwear and Accessories,Footwear Accessories,Waterproof Sprays,"
Sure! Here is a professional, industry-specific description for the subcategory ""Waterproof Sprays"" within the main category ""Footwear Accessories"":

Protect your feet from wet conditions with our waterproof sprays. Keep your shoes and boots dry and comfortable all day long."
Footwear and Accessories,Bags & Wallets,Men's Wallets,"
Sure! Here is a professional, industry-specific description for the subcategory ""Men's Wallets"" within the main category ""Bags & Wallets"":

""High-quality, stylish men's wallets designed to organize your essentials with ease. From slim profile designs to rugged adventure wallets, find the perfect fit for your lifestyle."""
Footwear and Accessories,Bags & Wallets,Women's Wallets,"
Sure! Here is a professional, industry-specific description for the subcategory ""Women's Wallets"" within the main category ""Bags & Wallets"":

Women's Wallets: Stylish and functional wallets designed specifically for women, featuring slim profiles, sleek designs, and ample storage space for cards, cash, and personal items. Perfect for everyday use or special occasions."
Footwear and Accessories,Bags & Wallets,Backpacks,"
Backpacks - Essential travel companions for adventurous spirits. Store all your essentials in style with durable, comfortable backpacks designed for long days on the go."
Footwear and Accessories,Bags & Wallets,Handbags,"
Handbags - Style and Function in One. Discover our luxury handbags designed to elevate your look and keep your essentials organized. From sleek totes to stylish crossbody bags, find the perfect accessory for any occasion."
Footwear and Accessories,Bags & Wallets,Laptop Bags,"
Sure! Here is a professional, industry-specific description for the subcategory ""Laptop Bags"" within the main category ""Bags & Wallets"":

""Stylish and protective laptop bags designed to keep your device safe and secure during transport. Choose from a range of styles and sizes to fit your needs."""
Footwear and Accessories,Bags & Wallets,Duffel Bags,"
Sure! Here is a professional, industry-specific description for the subcategory ""Duffel Bags"" within the main category ""Bags & Wallets"":

Duffel Bags: Durable and versatile bags designed for long trips or sports equipment transport. Made with high-quality materials and features reinforced stitching for added durability."
Footwear and Accessories,Socks,Ankle-Length Socks,"
Sure! Here is a professional and industry-specific description for the subcategory ""Ankle-Length Socks"" within the main category of Socks:

Ankle-Length Socks: Comfortable, supportive socks that reach mid-calf height for optimal comfort and style. Perfect for workwear or everyday wear."
Footwear and Accessories,Socks,Crew-Length Socks,"
Sure! Here is a professional, industry-specific description for the subcategory ""Crew-Length Socks"" within the main category ""Socks"":

""Crew-Length Socks: Perfect for long days on set or in the office, our crew-length socks offer maximum comfort and support without sacrificing style. Made with breathable materials and designed to stay up all day, these socks are a must-have for any professional on the go."" (198 characters)"
Footwear and Accessories,Socks,Sports Socks,"
Sure! Here's a professional, industry-specific description for the subcategory ""Sports Socks"" within the main category of Socks:

Sports socks are designed to provide comfort and support during high-intensity activities like running, basketball, or soccer. With extra cushioning and moisture-wicking properties, these socks help reduce blisters and keep your feet dry for longer."
Sports & Fitness Products,Sports Equipment,Cricket Equipment,"
Sure! Here is a professional, industry-specific description for the subcategory ""Cricket Equipment"" within the main category of Sports Equipment:

Cricket Equipment: High-quality bats, balls, gloves, and protective gear for serious cricket enthusiasts. Find everything you need to take your game to the next level."
Sports & Fitness Products,Sports Equipment,Football Equipment,"
Sure! Here is a professional, industry-specific description for the subcategory ""Football Equipment"" within the main category of Sports Equipment:

Football Equipment includes protective gear, sports bags, and training accessories designed for football players. From helmets to cleats, our selection provides the gear you need to perform at your best on the field."
Sports & Fitness Products,Sports Equipment,Badminton Equipment,"
Sure! Here is a professional, industry-specific description for the subcategory ""Badminton Equipment"" within the main category ""Sports Equipment"":

Badminton Equipment: High-quality rackets, shuttlecocks, and shoes designed for optimal performance and comfort on the court. From beginners to professionals, our badminton gear is engineered for maximum accuracy and control."
Sports & Fitness Products,Sports Equipment,Tennis Equipment,"
Tennis Equipment: High-quality rackets, shoes, and apparel designed for maximum performance on the court. From beginner to pro, our equipment is engineered to help you dominate your game."
Sports & Fitness Products,Sports Equipment,Basketball Equipment,"
Basketball Equipment: High-quality hoops and gear for the court. From shoes to balls to nets, we've got everything you need to slam dunk your competition."
Sports & Fitness Products,Sports Equipment,Table Tennis Equipment,"
Sure! Here is a professional and industry-specific description for the subcategory ""Table Tennis Equipment"" within the main category ""Sports Equipment"":

 Table Tennis Equipment: High-quality paddles, balls, and tables designed to enhance your table tennis experience. From beginner to pro, find the right gear to improve your game."
Sports & Fitness Products,Sports Equipment,Volleyball Equipment,"
Volleyball Equipment - Sports Equipment: High-quality volleyballs, nets, and other accessories for optimal play. From beginner to pro, our equipment helps players achieve their best on the court."
Sports & Fitness Products,Sports Equipment,Hockey Equipment,"
Sure! Here is a professional, industry-specific description for the subcategory ""Hockey Equipment"" within the main category ""Sports Equipment"":

Hockey Equipment: High-performance gear for the fastest sport on ice. From sticks and pucks to helmets and pads, our selection is designed to help you dominate the rink."
Sports & Fitness Products,Sports Equipment,Baseball Equipment,"
Baseball Equipment: High-quality bats, gloves, balls, and protective gear for players of all skill levels. Perfect for both recreational and competitive play."
Sports & Fitness Products,Sports Footwear,Running Shoes,"
Sure, here's a professional and concise description for the subcategory ""Running Shoes"" within the main category ""Sports Footwear"":

""Designed for maximum comfort and support during high-intensity activities, our running shoes provide cushioning, stability, and breathability to help you push your limits. Whether you're a seasoned marathon runner or a casual jogger, our innovative designs will keep you moving forward."""
Sports & Fitness Products,Sports Footwear,Football Shoes,"
Sure! Here's a professional, industry-specific description for the subcategory ""Football Shoes"" within the main category ""Sports Footwear"":

Football Shoes: Designed for high-impact movements on grass or turf, with cushioning and support to help athletes perform at their best. Engineered for stability, traction, and comfort during intense play."
Sports & Fitness Products,Sports Footwear,Cricket Shoes,"
Sure, here's a professional and industry-specific description for the subcategory ""Cricket Shoes"" within the main category ""Sports Footwear"":

Cricket Shoes: Engineered for precision and agility on the cricket pitch. Lightweight design and grippy soles provide optimal traction and support for quick movements."
Sports & Fitness Products,Sports Footwear,Badminton Shoes,"
Sure! Here's a professional and concise description for the subcategory ""Badminton Shoes"" under the main category ""Sports Footwear"":

""Designed specifically for the quick movements and stops required in badminton, our badminton shoes provide superior grip and support to help you dominate the court. With a lightweight and breathable design, you'll be able to perform at your best without feeling weighed down."""
Sports & Fitness Products,Sports Footwear,Tennis Shoes,"
Sure! Here's a professional, industry-specific description for the subcategory ""Tennis Shoes"" within the main category ""Sports Footwear"":

Tennis Shoes: Designed for quick movements and agility on the court, these shoes provide excellent support and traction to help you dominate your opponents. With breathable mesh panels and cushioned insoles, you'll stay comfortable throughout your match."
Sports & Fitness Products,Fitness Equipment,Treadmills,"
Sure! Here is a professional, industry-specific description for the subcategory ""Treadmills"" within the main category ""Fitness Equipment"":

""Treadmills are state-of-the-art exercise machines designed to provide a convenient and controlled running or walking workout experience. With adjustable incline and speed settings, users can customize their workout for optimal results."""
Sports & Fitness Products,Fitness Equipment,Exercise Bikes,"
Sure! Here is a professional, industry-specific description for the subcategory ""Exercise Bikes"" within the main category ""Fitness Equipment"":

""Elevate your cardiovascular workouts with our selection of high-quality exercise bikes. From recreational to professional-grade, find the perfect bike for your fitness goals."""
Sports & Fitness Products,Fitness Equipment,Dumbbells & Barbells,"
Sure! Here's a professional and industry-specific description for the subcategory ""Dumbbells & Barbells"" within the main category ""Fitness Equipment"":

""Dumbbells & Barbells: Elevate your workout routine with weights designed to build strength and endurance. Choose from a variety of sizes and styles to suit your fitness goals."""
Sports & Fitness Products,Fitness Equipment,Resistance Bands,"
Resistance Bands - Fitness Equipment:
Elastic bands that provide versatile resistance for strength training & stretching, portable & affordable, suitable for home or gym use."
Sports & Fitness Products,Fitness Equipment,Yoga Mats,"
Sure! Here is a professional, industry-specific description for the subcategory ""Yoga Mats"" within the main category ""Fitness Equipment"":

""High-quality yoga mats designed for comfort and grip, providing the perfect surface for your yoga practice. Choose from a range of styles and materials to suit your needs."""
Sports & Fitness Products,Fitness Equipment,Skipping Ropes,"
Sure! Here is a professional, industry-specific description for the subcategory ""Skipping Ropes"" within the main category ""Fitness Equipment"":

Skipping ropes are a versatile fitness tool for cardio workouts, strength training, and coordination exercises. Perfect for home or gym use, these lightweight ropes provide a full-body workout with minimal impact on joints."
Sports & Fitness Products,Fitness Accessories,Gym Gloves,"
Sure! Here's a professional, industry-specific description for the subcategory ""Gym Gloves"" within the main category ""Fitness Accessories"":

""Protect your hands while lifting weights or performing other gym activities with our durable and comfortable gym gloves. Designed to provide grip and support during intense workouts, these gloves are essential for any serious fitness enthusiast."" (Under 200 characters)"
Sports & Fitness Products,Fitness Accessories,Water Bottles,"
Sure, here's a professional and concise description for the subcategory ""Water Bottles"" within the main category ""Fitness Accessories"":

""Stay hydrated on the go with our selection of water bottles, designed for durability and convenience. From insulated to collapsible, find the perfect bottle for your fitness routine."""
Sports & Fitness Products,Fitness Accessories,Sweatbands & Headbands,"
Sure! Here is a professional and concise description for the subcategory ""Sweatbands & Headbands"" within the main category ""Fitness Accessories"":

Sweatbands & Headbands: Keep your hair and face dry during your workout with our selection of stylish and functional sweatbands and headbands. Perfect for runners, yogis, and fitness enthusiasts alike."
Sports & Fitness Products,Outdoor & Adventure Gear,Camping Tents,"
Camping Tents: Durable, weather-resistant shelters for outdoor adventures. From backyard camping to rugged wilderness expeditions, our tents provide comfort and protection for all your outdoor escapes."
Sports & Fitness Products,Outdoor & Adventure Gear,Hiking Backpacks,"
Sure! Here is a professional, industry-specific description for the subcategory ""Hiking Backpacks"" within the main category ""Outdoor & Adventure Gear"":

""Designed for rugged adventures, hiking backpacks offer durable construction, comfortable fit, and ample storage space for all your gear. Essential for any outdoor excursion."""
Sports & Fitness Products,Outdoor & Adventure Gear,Trekking Poles,"
Trekking poles are essential for any outdoor adventure. These lightweight, collapsible poles provide stability and support on uneven terrain, allowing you to navigate challenging landscapes with ease and confidence. Whether you're hiking in the mountains or exploring the desert, trekking poles are a must-have for any outdoor enthusiast."
Automobile Accessories,Interior Accessories,Car Seat Covers,"
Car Seat Covers - Protect Your Vehicle's Upholstery with Style. Durable covers for car seats, custom-fit for maximum protection."
Automobile Accessories,Interior Accessories,Steering Wheel Covers,"
Steering Wheel Covers - Protect your steering wheel from wear and tear with stylish and durable covers. Choose from a variety of designs and materials to match your car's interior."
Automobile Accessories,Interior Accessories,Floor Mats & Carpets,"
Sure! Here is a professional, industry-specific description for the subcategory ""Floor Mats & Carpets"" within the main category ""Interior Accessories"":

Floor mats & carpets enhance interior spaces with durable, aesthetically pleasing solutions. From entrance mats to custom carpeting, our products protect and add style to any environment."
Automobile Accessories,Interior Accessories,Dashboard Covers,"
Dashboard Covers: Protect your car's dashboard from UV rays and daily wear & tear with our durable, custom-fit covers. Stylish designs available for a personalized look."
Automobile Accessories,Interior Accessories,Sun Shades,"
Sun Shades - Protect your home or office from harsh sunlight with our stylish and functional sun shades. Available in various materials and designs, these shades provide privacy and glare reduction while maintaining a comfortable indoor environment."
Automobile Accessories,Interior Accessories,Car Organizers,"
Car Organizers - Keep Your Vehicle Tidy & Efficient: Organize your car's interior with our range of practical and stylish accessories. From storage solutions to tech integrations, we have everything you need to keep your vehicle tidy and efficient."
Automobile Accessories,Interior Accessories,Mobile Holders,"
Sure! Here is a professional and concise description for the subcategory ""Mobile Holders"" within the main category ""Interior Accessories"":

""Elevate your car's interior with our mobile holders, designed to securely hold your phone or GPS while driving. Keep your devices within easy reach and reduce distractions on the road."""
Automobile Accessories,Interior Accessories,Air Fresheners,"
Sure! Here's a professional, industry-specific description for the subcategory ""Air Fresheners"" within the main category ""Interior Accessories"":

""Air fresheners are essential for maintaining a pleasant indoor atmosphere. Our range of scented sprays and dispensers provide long-lasting fragrance and odor protection, leaving your home or office smelling fresh and clean."""
Automobile Accessories,Exterior Accessories,Car Covers,"
Car Covers - Protect Your Vehicle's Exterior with Ease

Keep your car looking new and well-maintained with a high-quality car cover. Our covers are designed to protect your vehicle's exterior from dust, UV rays, and other environmental factors, making it easy to maintain its appearance over time."
Automobile Accessories,Exterior Accessories,Bumper Protectors,"
Bumper Protectors - Keep Your Vehicle's Bumpers in Pristine Condition!
Protect your car's bumpers from scratches and damage with our durable and stylish Bumper Protectors. Easy to install and available in various designs, these protectors ensure your vehicle looks great and stays safe on the road."
Automobile Accessories,Exterior Accessories,Car Stickers & Decals,"
Car Stickers & Decals - Add style and personality to your vehicle with our wide range of decals, stickers, and graphics. From fun designs to personalized plates, we have everything you need to make your car stand out on the road."
Automobile Accessories,Exterior Accessories,Number Plate Frames,"
Sure! Here is a professional, industry-specific description for the subcategory ""Number Plate Frames"" within the main category ""Exterior Accessories"":

Number plate frames add a touch of style and protection to your vehicle's license plate, while also helping to keep it clean and free from damage. Choose from a range of designs and materials to match your car's unique look and personality."
Automobile Accessories,Exterior Accessories,Mud Flaps,"
Sure! Here is a professional, industry-specific description for the subcategory ""Mud Flaps"" within the main category ""Exterior Accessories"":

Mud Flaps: Protect your vehicle's exterior from mud and debris with durable, easy-to-install mud flaps. Keep your car looking great and running smoothly with these essential accessories."
Automobile Accessories,Exterior Accessories,Side Window Deflectors,"
Here is a professional, industry-specific description for the subcategory ""Side Window Deflectors"" within the main category ""Exterior Accessories"":

""Protect your car's windows from debris and noise with our Side Window Deflectors. Easy to install and durable, they help keep your ride quiet and clean on the road."" (Under 200 characters)"
Automobile Accessories,Exterior Accessories,Roof Racks & Carriers,"
Sure! Here's a professional and concise description for the subcategory ""Roof Racks & Carriers"" within the main category ""Exterior Accessories"":

Roof Racks & Carriers: Store and transport your gear with ease using our selection of roof racks and carriers. From bike carriers to kayak holders, we have the perfect solution for all your outdoor adventures."
