L1,L2,L3,Description
Furniture,Outdoor Furniture,Patio Chairs & Loungers,"
Sure! Here's a professional, industry-specific description for the subcategory ""Patio Chairs & Loungers"" within the main category ""Outdoor Furniture"":

Patio chairs and loungers provide comfortable seating options for outdoor entertaining. Choose from a range of styles and materials to complement your backyard oasis."
Furniture,Outdoor Furniture,Garden Tables,"
Sure! Here is a professional and concise description for the subcategory ""Garden Tables"" within the main category of Outdoor Furniture:

""Garden tables offer a functional and stylish solution for al fresco dining, socializing or working. Choose from a range of materials and designs to complement your outdoor space."" (197 characters)"
Furniture,Outdoor Furniture,Swing Chairs,"
Sure! Here's a professional and concise description for the subcategory ""Swing Chairs"" within the main category of Outdoor Furniture:

Swing Chairs: Relax in style with our comfortable and visually appealing swing chairs, perfect for your outdoor living space. Enjoy the gentle rocking motion while soaking up the sun or shade, creating a tranquil atmosphere for your guests to enjoy."
Furniture,Outdoor Furniture,Outdoor Benches,"
Outdoor Benches - Comfortable seating for alfresco relaxation. Designed for durability and weather resistance, our outdoor benches provide a cozy spot to enjoy nature."
Furniture,Outdoor Furniture,Hammocks,"
Sure! Here is a professional, industry-specific description for the subcategory ""Hammocks"" within the main category ""Outdoor Furniture"":

""Relax and unwind in style with our selection of high-quality hammocks, designed to provide maximum comfort and enjoyment in your outdoor space."""
Furniture,Storage & Organization,Shoe Racks,"
Sure! Here is a professional and industry-specific description for the subcategory ""Shoe Racks"" within the main category of Storage & Organization:

""Stay organized and keep your shoes in check with our selection of shoe racks. From wall-mounted designs to floor-standing options, we've got you covered."""
Furniture,Storage & Organization,Wall Shelves,"
Sure! Here is a professional and concise description for the subcategory ""Wall Shelves"" within the main category ""Storage & Organization"":

Wall shelves are vertical storage solutions that provide convenient and space-saving options for organizing and displaying items in your home or office. They can be mounted on walls, pegboards, or other surfaces to keep belongings within easy reach."
Furniture,Storage & Organization,Storage Cabinets,"
Storage Cabinets: Keep Your Space Organized
Efficiently store and protect your office or home essentials in stylish storage cabinets. Choose from a variety of designs and sizes to fit your unique needs."
Furniture,Storage & Organization,Drawers & Chests,"
Sure! Here is a professional and concise description for the subcategory ""Drawers & Chests"" within the main category ""Storage & Organization"":

""Organize your home or office with our wide range of stylish and functional drawers & chests. Keep your belongings neatly stored and easily accessible with our high-quality, durable pieces."""
Daily Essentials,Household Items,Cleaning Supplies,"
Cleaning Supplies - Essential for a Spotless Home
From scrubbers to sprays, our selection of cleaning supplies has everything you need to keep your home sparkling clean. Shop now and get ready to glow! #HouseholdItems #CleaningSupplies"
Daily Essentials,Household Items,Kitchen Cleaning Products,"
Kitchen Cleaning Products - Keep Your Cookspace Sparkling!  Our kitchen cleaning products are specifically designed to tackle tough cooking messes and leave your space smelling fresh and clean. From scrubbing sponges to disinfecting wipes, we've got everything you need to keep your kitchen looking its best. "
Daily Essentials,Household Items,Dishwashing Liquid,"
Dishwashing Liquid - Effective Cleaning for Your Home Dishes
A high-quality dishwashing liquid that helps you clean your home dishes with ease. Its powerful formula removes tough food residue, leaving your dishes sparkling and fresh."
Daily Essentials,Household Items,Brooms and Brushes,"
Sure! Here is a professional, industry-specific description for the subcategory ""Brooms and Brushes"" within the main category ""Household Items"":

""Brooms and brushes are essential household items for cleaning floors, dusting surfaces, and removing dirt and debris. Our selection includes high-quality, durable brooms and brushes in various sizes and shapes to suit your cleaning needs."""
Daily Essentials,Household Items,Vacuum Cleaners,"
Sure! Here is a professional, industry-specific description for the subcategory ""Vacuum Cleaners"" within the main category ""Household Items"":

Vacuum cleaners are essential household items used to remove dirt, dust, and allergens from floors, carpets, and upholstery. With their powerful suction and versatile attachments, vacuums make cleaning easier and more efficient than ever before."
Daily Essentials,Personal Care,Bathing Soaps,"
Sure! Here is a professional, industry-specific description for the subcategory ""Bathing Soaps"" within the main category of Personal Care:

""Bathing Soaps: Gentle, nourishing cleansers for a refreshing and invigorating bathing experience. Choose from a variety of scents and formulations to suit your skin type and preferences."""
Daily Essentials,Personal Care,Shampoos and Conditioners,"
Shampoos and Conditioners - Professional Description:

Elevate your hairstyle with our range of shampoos and conditioners tailored for your specific hair type. From nourishing formulas for dry scalps to volume-boosting treatments, we've got you covered for a salon-quality look at home."
Daily Essentials,Personal Care,Face Wash,"
Sure! Here's a concise and industry-specific description for the subcategory ""Face Wash"" within the main category ""Personal Care"":

""Cleanse your face with our gentle, non-irritating Face Wash. Removes dirt and impurities without stripping skin of its natural oils."" (Under 200 characters)"
Daily Essentials,Personal Care,Body Lotions,"
Sure! Here is a professional, industry-specific description for the subcategory ""Body Lotions"" within the main category ""Personal Care"":

Body Lotions: Moisturize and soften your skin with our range of lotions formulated for specific skin types and concerns. Find the perfect match for your body's needs."
Daily Essentials,Personal Care,Deodorants and Perfumes,"
Sure! Here is a professional, industry-specific description for the subcategory ""Deodorants and Perfumes"" within the main category of Personal Care:

Deodorants and perfumes are essential personal care products that help individuals feel confident and fresh throughout the day. These products work to control body odor and provide a pleasant fragrance, helping individuals feel more comfortable in their own skin."
Daily Essentials,Groceries,Rice & Grains,"
Sure! Here is a professional, industry-specific description for the subcategory ""Rice & Grains"" within the main category ""Groceries"":

Rice & Grains: Stock up on the essentials with our wide selection of rice and grains, including varieties from around the world. From long-grain to brown rice, we've got you covered for all your culinary needs."
Daily Essentials,Groceries,Instant Noodles,"
Instant Noodles are a convenient and quick meal solution within the Groceries category. These pre-cooked noodle dishes can be prepared in minutes, saving time and effort for busy individuals and families."
Daily Essentials,Groceries,Spices and Condiments,"
Sure! Here's a professional, industry-specific description for the subcategory ""Spices and Condiments"" within the main category ""Groceries"":

""Elevate your culinary creations with our diverse selection of spices and condiments. From classic salt and pepper to exotic blends, find the perfect flavor enhancers for any dish."""
Daily Essentials,Groceries,Packaged Snacks,"
Sure! Here's a professional and industry-specific description for the subcategory ""Packaged Snacks"" within the main category ""Groceries"":

""Packaged snacks offer quick and convenient options for satisfying hunger pangs. From crunchy chips to chewy granola bars, our selection has something for every taste bud."""
Daily Essentials,Groceries,Frozen Foods,"
Sure! Here is a professional, industry-specific description for the subcategory ""Frozen Foods"" within the main category ""Groceries"":

Frozen Foods: Delicious, convenient meals that are ready when you are. From vegetables to meats, our frozen options provide a quick and easy solution for busy households."
Daily Essentials,Beverages,Tea & Coffee,"
Sure! Here is a professional, industry-specific description for the subcategory ""Tea & Coffee"" within the main category ""Beverages"":

""Experience the rich flavors of tea and coffee from around the world. From traditional brews to unique blends, our selection offers something for every palate."""
Daily Essentials,Beverages,Juices & Soft Drinks,"
Sure! Here is a professional, industry-specific description for the subcategory ""Juices & Soft Drinks"" within the main category ""Beverages"":

""Juices & Soft Drinks: Refreshing and flavorful beverages made from fruit, vegetables, or artificial ingredients. Perfect for quenching thirst or adding a twist to your favorite recipes."""
Daily Essentials,Beverages,Energy Drinks,"
Sure! Here's a concise and industry-specific description for the subcategory ""Energy Drinks"" within the main category ""Beverages"":

Energy drinks are powerful beverages designed to provide a quick energy boost, typically containing high levels of caffeine and other stimulants. These drinks are popular among students, athletes, and working professionals looking for a quick pick-me-up."
Daily Essentials,Beverages,Milk and Dairy Products,"
Sure! Here is a professional and concise description for the subcategory Milk and Dairy Products within the main category Beverages:

Milk and dairy products are essential beverages that provide essential nutrients, including calcium, protein, and vitamins. They come in various forms, such as whole milk, skim milk, cheese, yogurt, and butter, catering to different tastes and dietary needs."
Daily Essentials,Beverages,Water and Sports Drinks,"
Here is a professional, industry-specific description for the subcategory ""Water and Sports Drinks"" within the main category ""Beverages"":

Water and sports drinks are essential beverages that help quench thirst and replenish fluids lost during physical activity. With a range of flavors and electrolyte levels, these drinks provide the necessary hydration for athletes and fitness enthusiasts to perform at their best."
Daily Essentials,Baby Products,Diapers and Wipes,"
Sure! Here is a professional and concise description for the subcategory ""Diapers and Wipes"" within the main category of Baby Products:

""Diapers and wipes for babies, designed to provide comfortable and hygienic protection during diaper changes. Our products offer superior absorbency and gentle skin care for your little one's delicate skin."""
Daily Essentials,Baby Products,Baby Food,"
Sure! Here is a professional, industry-specific description for the subcategory ""Baby Food"" within the main category ""Baby Products"":

""Nourishing meals for little ones, crafted with love and care. From pureed fruits and veggies to allergen-friendly options, our baby food range has everything you need for a happy, healthy baby."""
Daily Essentials,Baby Products,Baby Clothes,"
Sure! Here is a professional and concise description for the subcategory ""Baby Clothes"" within the main category ""Baby Products"":

Baby Clothes: Soft, comfortable, and adorable outfits for your little one's daily adventures. From cute onesies to cozy pajamas, our baby clothes are designed to keep your baby happy and comfortable."
Daily Essentials,Baby Products,Baby Bathing and Skin Care,"
Sure! Here is a professional, industry-specific description for the subcategory ""Baby Bathing and Skin Care"" within the main category ""Baby Products"":

""Keep your little one's skin healthy and clean with our range of gentle baby bath products and skin care essentials. From soft, absorbent diapers to soothing lotions and creams, we've got everything you need for happy, comfortable babies."""
Daily Essentials,Baby Products,Baby Health Products,"
Sure! Here is a professional, industry-specific description for the subcategory ""Baby Health Products"" within the main category ""Baby Products"":

""Baby Health Products: Essential items for a healthy baby, including breast pumps, baby monitors, and natural remedies for colic and teething. Keep your little one happy and healthy with our top-quality products."""
Daily Essentials,Health & Wellness,Vitamins & Supplements,"
Sure! Here is a professional, industry-specific description for the subcategory Vitamins & Supplements within the main category Health & Wellness:

Vitamins & Supplements: Essential nutrients for optimal health. Boost your wellness routine with high-quality supplements tailored to your needs."
Daily Essentials,Health & Wellness,Health Drinks,"
Here is a possible professional, industry-specific description for the subcategory ""Health Drinks"" within the main category ""Health & Wellness"":

""Healthy drinks that promote wellness from within. Formulated with natural ingredients and essential nutrients to support immune function, digestion, and overall health."""
Daily Essentials,Health & Wellness,First Aid and Bandages,"
Here is a professional, industry-specific description for the subcategory ""First Aid and Bandages"" within the main category ""Health & Wellness"":

""Providing immediate care for injuries or illnesses with first aid kits and bandages. Offering protection and relief to promote recovery."" (Under 200 characters)"
Daily Essentials,Health & Wellness,Fitness Supplements,"
Sure! Here is a professional and industry-specific description for the subcategory ""Fitness Supplements"" within the main category of ""Health & Wellness"":

Fitness supplements help fuel your workouts and support overall health. From protein powder to creatine, find the right supplement to meet your fitness goals."
Daily Essentials,Health & Wellness,Medicines,"
Sure! Here's a professional, industry-specific description for the subcategory ""Medicines"" within the main category ""Health & Wellness"":

""Medicines: Developing and delivering safe, effective pharmaceuticals to treat various health conditions and improve quality of life. From prescription drugs to over-the-counter supplements, our medicines are designed to help you feel better and live healthier."""
Daily Essentials,Pet Care,Pet Food,"
Sure! Here is a concise and industry-specific description for the subcategory ""Pet Food"" within the main category ""Pet Care"":

""Nourishing meals for furry friends. From grain-free to limited ingredient, our pet food options cater to your pet's unique needs and preferences."""
Daily Essentials,Pet Care,Pet Grooming Products,"
Sure! Here is a professional, industry-specific description for the subcategory ""Pet Grooming Products"" within the main category ""Pet Care"":

""Elevate your pet's grooming routine with our line of high-quality grooming products, designed to keep your furry friend looking and feeling their best. From shampoos and conditioners to nail clippers and brushes, we have everything you need for a pampered pooch."""
Daily Essentials,Pet Care,Pet Toys and Accessories,"
Sure! Here's a professional, industry-specific description for the subcategory ""Pet Toys and Accessories"" within the main category ""Pet Care"":

""Pet Toys and Accessories: Keep your furry friend entertained and happy with a wide range of fun and durable toys, chews, and treats. From interactive puzzle toys to cozy blankets, we've got everything you need to keep your pet happy and healthy."""
Daily Essentials,Pet Care,Pet Health & Wellness,"
Sure! Here's a professional, industry-specific description for the subcategory ""Pet Health & Wellness"" within the main category ""Pet Care"":

""Providing comprehensive healthcare services for pets, including vaccinations, parasite control, and wellness exams. Promoting overall pet wellness through nutrition, exercise, and preventative care."""
Daily Essentials,Pet Care,Pet Bedding,"
Sure! Here is a professional and concise description for the subcategory of Pet Bedding within the main category of Pet Care:

Pet Bedding: Cozy beds and comfortable resting spots for your furry friends, designed to provide comfort and support during their sleepy time. From soft cushions to plush blankets, our pet bedding range offers a variety of styles to suit your pet's preferences and needs."
Daily Essentials,Office Supplies,Notebooks and Diaries,"
Notebooks and diaries are essential tools for professionals and students alike, providing a space for notes, ideas, and creative expression. Durable and versatile, they help organize thoughts and projects, and serve as a valuable resource for brainstorming and goal-setting."
Daily Essentials,Office Supplies,Pens and Pencils,"
Sure! Here is a professional, industry-specific description for the subcategory ""Pens and Pencils"" within the main category of Office Supplies:

""Essential writing instruments for productive workdays. Choose from a range of high-quality pens and pencils to keep your workspace stocked and organized."""
Daily Essentials,Office Supplies,Printer Papers and Cartridges,"
Sure! Here is a professional, industry-specific description for the subcategory ""Printer Papers and Cartridges"" within the main category ""Office Supplies"":

""High-quality printing materials and cartridges for efficient and productive office workflows. Including paper, ink, and toner for various printer models."" (Under 200 characters)"
Daily Essentials,Office Supplies,Files and Folders,"
Sure! Here's a professional and concise description for the subcategory ""Files and Folders"" within the main category ""Office Supplies"":

 Files and Folders: Organize your workspace with ease. From compact folders to sturdy file boxes, keep your important documents secure and within reach."
Daily Essentials,Office Supplies,Desk Organizers,"
Here's a professional, industry-specific description for the subcategory ""Desk Organizers"" within the main category ""Office Supplies"":

Organize your workspace with ease using our selection of desk organizers. From pen holders to file folders, find the perfect solution to keep your desk tidy and productive."
Daily Essentials,Stationery,Envelopes and Labels,"
Here is a professional, industry-specific description for the subcategory ""Envelopes and Labels"" within the main category ""Stationery"":

Envelopes and labels are an essential part of any stationery collection. From formal business envelopes to colorful self-stick labels, these products help to add a touch of professionalism and organization to any document or package."
Daily Essentials,Stationery,Paper Clips and Binder Clips,"
Here is a professional and industry-specific description for the subcategory ""Paper Clips and Binder Clips"" within the main category ""Stationery"":

Paper Clips and Binder Clips are essential tools for organizing and managing documents, papers, and other office materials. These clips provide a secure and convenient way to keep items together, promoting efficiency and productivity in any workplace."
Daily Essentials,Stationery,Sticky Notes,"
Sure! Here is a professional and industry-specific description for the subcategory ""Sticky Notes"" under the main category ""Stationery"":

Sticky Notes: Colorful and convenient, our sticky notes are the perfect way to jot down reminders, appointments, or inspiring quotes. From small squares to larger pads, they're easy to use and always within reach."
Daily Essentials,Stationery,Erasers and Sharpeners,"
Erasers and Sharpeners are a vital part of any stationery collection, helping to maintain and improve writing instruments for optimal performance. From erasing mistakes to keeping pencils sharp, these tools ensure that your writing stays accurate and clean."
Daily Essentials,Stationery,Highlighters and Markers,"
Sure! Here is a professional, industry-specific description for the subcategory ""Highlighters and Markers"" within the main category ""Stationery"":

Highlighters and markers are essential tools for organizing and presenting information in a clear and concise manner. These versatile products allow users to highlight important text, add notes and annotations, and create visually appealing documents."
Daily Essentials,Toiletries,Toilet Papers,"
Toilet Papers - Essential for personal hygiene and cleanliness, toilet papers are designed to absorb and dispose of waste with ease. From sensitive skin to heavy duty use, our range offers the perfect solution for any bathroom need."
Daily Essentials,Toiletries,Shampoo and Conditioner,"
Shampoo and Conditioner - Essential Haircare for a Fresh Start: Keep your locks looking and feeling great with our gentle, nourishing shampoo and conditioner duo. Formulated with plant-based ingredients, these products will leave your hair soft, smooth, and full of life."
Daily Essentials,Toiletries,Toothpaste and Toothbrushes,"
Toothpaste and Toothbrushes: Keep your smile shining bright with our selection of high-quality toothpastes and brushes. From fluoride toothpastes for cavity protection to gentle brushes for sensitive teeth, we've got you covered."
Daily Essentials,Toiletries,Shaving and Hair Removal Products,"
Sure! Here is a professional and concise description for the subcategory ""Shaving and Hair Removal Products"" within the main category ""Toiletries"":

Shaving and hair removal products help you achieve smooth, silky skin with ease. From razors to creams and gels, our selection offers effective solutions for both men and women."
Daily Essentials,Toiletries,Bathroom Cleaners,"
Bathroom Cleaners - Keep Your Bathroom Spotless!  Our bathroom cleaners are specially formulated to tackle dirt, grime & odors in every corner of the bathroom. From toilet bowls to sink basins, we've got you covered.  #Toiletries #BathroomCleaners #Spotless"
Daily Essentials,Hygiene Products,Hand Wash and Sanitizers,"
Hand wash and sanitizers are an essential part of maintaining proper hygiene in various industries. These products help prevent the spread of germs and bacteria, ensuring a clean and healthy environment for employees and customers alike."
Daily Essentials,Hygiene Products,Feminine Hygiene Products,"
Here is a professional, industry-specific description for the subcategory ""Feminine Hygiene Products"" within the main category ""Hygiene Products"":

Feminine Hygiene Products: Essential items for women's personal care, including sanitary napkins, tampons, and pantyliners, designed to manage menstrual flow and promote hygiene during the reproductive cycle."
Daily Essentials,Hygiene Products,Wet Wipes and Tissues,"
Sure! Here is a professional, industry-specific description for the subcategory ""Wet Wipes and Tissues"" within the main category ""Hygiene Products"":

""Wet wipes and tissues for personal hygiene needs. Soft, absorbent, and gentle on skin, ideal for face, hands, and body cleaning on-the-go."""
Daily Essentials,Hygiene Products,Toilet Brushes and Holders,"
Sure! Here's a professional and concise subcategory description for Toilet Brushes and Holders within the Hygiene Products main category:

""Toilet Brushes and Holders keep bathrooms clean and hygienic by effectively removing waste and debris from toilet bowls. Choose from a range of durable and easy-to-use designs for optimal cleaning performance."""
Pooja Essentials,Pooja Samagri,Agarbatti (Incense Sticks),"
Agarbatti (Incense Sticks) - Pooja Samagri:
Elegant, aromatic sticks for sacred rituals, enhancing the ambiance of your puja space with each burn."
Pooja Essentials,Pooja Samagri,Dhoop Cones,"
Sure! Here is a professional and concise description for the subcategory ""Dhoop Cones"" within the main category ""Pooja Samagri"":

Dhoop Cones: Essential for creating sacred smoke during pujas, these cone-shaped structures are made from high-quality materials and designed to burn evenly, producing a fragrant and purifying smoke."
Pooja Essentials,Pooja Samagri,Camphor (Kapoor),"
Camphor (Kapoor) is a popular Pooja Samagri used in Hindu rituals for its purifying and fragrant properties. It is commonly used to purify the atmosphere before prayer or puja, and is believed to bring good luck and prosperity."
Pooja Essentials,Pooja Samagri,Cotton Wicks (Batti),"
Sure! Here is a professional and industry-specific description for the subcategory ""Cotton Wicks (Batti)"" under the main category ""Pooja Samagri"":

""Cotton wicks (batti) are an essential component of various pujas and rituals. High-quality cotton wicks ensure consistent and even burning of incense, offering a pleasing aroma and ambiance for religious ceremonies."""
Pooja Essentials,Pooja Samagri,Chandan (Sandalwood) Powder,"
Here is a professional, industry-specific description for the subcategory ""Chandan (Sandalwood) Powder"" within the main category ""Pooja Samagri"":

Chandan (Sandalwood) Powder - A sacred and highly valued ingredient in Hindu pujas, this fine powder is obtained from the heartwood of the sandalwood tree. Used for purification and spiritual offerings, it imparts a subtle yet distinct fragrance to the surroundings, creating a serene atmosphere for prayer and meditation."
